[
  {
    "schema_version": "1.0.0",
    "profile_id": "prof_analyst_en",
    "mode": "analyst",
    "lang": "en",
    "favorite_team_ids": [
      "t_ald"
    ],
    "favorite_player_ids": [],
    "focus": {
      "kind": "metric",
      "metric": "pressure_index"
    },
    "density": "rich"
  },
  {
    "schema_version": "1.0.0",
    "profile_id": "prof_casual_sw",
    "mode": "casual",
    "lang": "sw",
    "favorite_team_ids": [
      "t_ngt"
    ],
    "favorite_player_ids": [
      "p_110"
    ],
    "focus": {
      "kind": "player",
      "player_id": "p_110"
    },
    "density": "minimal"
  }
]
